{
  "schema_version": "qis-evidence-envelope.v1",
  "receipt_id": "receipt.qis-agent-harness.fixture-valid-provenance",
  "issue_ref": "Quirk-Systems/quirk-os#27",
  "admission_scope": "candidate_evidence_only",
  "authority": {
    "admission_authority": "human.bryan",
    "candidate_runtime_authority": "none",
    "candidate_can_self_promote": false,
    "gate_satisfaction_allowed": false
  },
  "repository": {
    "owner": "Quirk-Systems",
    "repo": "quirk-os",
    "candidate_branch": "agent/quirk-intent-shaper",
    "candidate_sha": "f5effa3d6da3e5879e10007492aeff39a1c643be",
    "base_sha": "f5effa3d6da3e5879e10007492aeff39a1c643be",
    "head_sha": "6cbccabb50e2589a16a6bfd53c0fa107452cd806",
    "merge_base_sha": "f5effa3d6da3e5879e10007492aeff39a1c643be",
    "is_traceable_descendant": true
  },
  "materials": [
    {"role": "instruction", "path": ".github/copilot-instructions.md", "sha256": "d2ee9e70d00c3010ec85a9573e1834e81cdd4f5f8aff5accf247366a873c2d77"},
    {"role": "instruction", "path": ".github/instructions/intent-shaper.instructions.md", "sha256": "34b3a0dbc6de40ae260be6f9fcf41b308aef95de56c5812850b3a101270b1bde"},
    {"role": "skill", "path": ".github/skills/intent-shaper-admission/SKILL.md", "sha256": "ee7d285cc440d3e02927d668a454f338447bd4e5928e585b745ec153b8adf37b"},
    {"role": "schema", "path": "schemas/personalization-plan.schema.json", "sha256": "cf7b2d1c1ce019415c623285228d32150b401c89e073a37bce7554accaa3ceeb"},
    {"role": "fixture", "path": "evals/intent-shaper/cases.json", "sha256": "e33d1e9c17760a7e2d762b605e240f01fc579b97867873fd3aa82fde0cb16ef6"}
  ],
  "commands": [
    {"name": "focused_tests", "kind": "unit_tests", "command": "python -m unittest tests.test_intent_shaper tests.test_qis_harness -v", "status": "passed", "exit_code": 0, "counts": {"passed": 18, "failed": 0, "total": 18}},
    {"name": "intent_shaper_conformance", "kind": "conformance", "command": "python scripts/validate_intent_shaper.py --repo . --output evals/intent-shaper/conformance-results.json", "status": "passed", "exit_code": 0, "counts": {"passed": 11, "failed": 0, "total": 11}}
  ],
  "evidence_refs": ["evals/intent-shaper/cases.json", "tests/test_intent_shaper.py", "tests/test_qis_harness.py"],
  "critical_failures": [],
  "limitations": [
    "Synthetic validation fixture superseding receipt.valid.json for current material provenance; command counts are test data, not execution evidence.",
    "Candidate-only harness evidence; no admission, merge, deployment, schedule, or persistence authority."
  ],
  "environment": {"runner_os": "Linux", "python": "3.13.0", "pip": "24.2", "jsonschema": "4.26.0"},
  "verdict": "PASS",
  "generated_at": "2026-10-04T12:49:21Z",
  "receipt_hash": "93f98965fdddaa38389f7402475917e7db959c7b7c013c37aaa8148384db3946"
}
